{
  "model": "riverside-editor",
  "messages": [
    {
      "role": "system",
      "content": "Answer from authorized manuscript context and cite each supported claim."
    },
    {
      "role": "user",
      "content": "What does Aria see beyond the rain?"
    }
  ],
  "max_input_tokens": 2048,
  "max_tokens": 256,
  "temperature": 0.1,
  "top_p": 1,
  "stream": false,
  "retrieval": {
    "enabled": true,
    "top_k": 6,
    "search_type": "hybrid",
    "filters": {
      "classification": [
        "confidential"
      ],
      "region": "eastus2"
    }
  }
}
